{
  "event_id": "evt_txn_ledger_001",
  "event_type": "ledgerlens.transaction.normalized",
  "schema_version": "1.0",
  "occurred_at": "2026-08-24T19:00:02Z",
  "run_id": "run_acme_august_close",
  "source": "ledgerlens.normalization",
  "idempotency_key": "normalized-txn-ledger-001",
  "payload": {
    "transaction_id": "txn_ledger_001",
    "raw_transaction_id": "raw_ledger_001",
    "account_id": "erp_cash_account",
    "source_system": "aurora_erp",
    "external_transaction_id": "AR-8127",
    "posting_date": "2026-08-23",
    "value_date": null,
    "amount": "1250.00",
    "currency": "USD",
    "direction": "credit",
    "description_raw": "ACME invoice payment INV-8127",
    "description_normalized": "ACME INVOICE PAYMENT INV 8127",
    "counterparty": "ACME INC",
    "reference": "INV-8127",
    "fingerprint_exact": "fx_usd_1250000_20260823_8127_acme",
    "fingerprint_loose": "fl_usd_1250000_8127_acme",
    "quality_flags": []
  }
}
