{
  "event_id": "evt_txn_bank_001",
  "event_type": "ledgerlens.transaction.normalized",
  "schema_version": "1.0",
  "occurred_at": "2026-08-24T19:00:01Z",
  "run_id": "run_acme_august_close",
  "source": "ledgerlens.normalization",
  "idempotency_key": "normalized-txn-bank-001",
  "payload": {
    "transaction_id": "txn_bank_001",
    "raw_transaction_id": "raw_bank_001",
    "account_id": "operating_bank",
    "source_system": "bank_a",
    "external_transaction_id": "BA-2026-0001",
    "posting_date": "2026-08-21",
    "value_date": "2026-08-21",
    "amount": "-1250.00",
    "currency": "USD",
    "direction": "debit",
    "description_raw": "ACH PAYMENT ACME INC INV 8127",
    "description_normalized": "ACH PAYMENT ACME INC INV 8127",
    "counterparty": "ACME INC",
    "reference": "8127",
    "fingerprint_exact": "fx_usd_1250000_20260821_8127_acme",
    "fingerprint_loose": "fl_usd_1250000_8127_acme",
    "quality_flags": []
  }
}
